,index,type,title,text,chars,scene,text_in_book,score,chapter,vote_chapter,vote_percentage
701,1025,dialog,BADGER DOCTOR,"Sir, you need to go, now! (calls out) Security! Sweep the area! ","{'nick': 7, 'hopps': 7}",52,"Security, sweep the area! ",0.8117401,11,11,0.8
702,1027,dialog,NICK,Great! We're dead. We're dead. That's it. I'm dead. You're dead. Everybody's dead. ,"{'nick': 7, 'hopps': 7}",52,"Great, we're dead. That's it. I'm dead. You're dead. Everybody's dead, ",0.95081717,11,11,0.8
703,1029,dialog,HOPPS,Can you swim? ,"{'nick': 7, 'hopps': 7}",52,Can you swim? ,0.99999994,11,11,0.8
704,1030,dialog,NICK,"What? Can I swim? Yes, I can swim. Why? ","{'nick': 7, 'hopps': 7}",52,What? Can I swim? Of course. Why? ,0.94391805,11,11,0.8
705,1032,dialog,NICK,Carrots?! Hopps?! Judy?! ,"{'nick': 7, 'hopps': 7}",52,Carrots? Hopps? Judy! ,0.9693636,11,11,0.8
706,1034,dialog,HOPPS,We gotta tell Bogo! ,"{'nick': 7, 'hopps': 7}",52,We've got to tell Bogo.,0.93720776,11,11,0.8
707,1036,dialog,GAZELLE,"Wow, you are one hot dancer... (robo-voice) ",{'bogo': 3},53,"Wow. You are one hot dancer, ",0.74894536,8,8,0.4
708,1038,dialog,CLAWHAUSER,Chief Bogo! ,{'bogo': 3},53,"Uh, Chief? Chief Bogo? ",0.8713711,24,8,0.4
709,1039,dialog,BOGO,(guilty) Not now! ,{'bogo': 3},53,Not now! ,0.5892311,28,8,0.4
710,1040,dialog,CLAWHAUSER,"Wait, is that Gazelle? ",{'bogo': 3},53,Have you seen Gazelle's new video—are you familiar with Gazelle? ,0.7357548,8,8,0.4
711,1041,dialog,BOGO,(struggling to silence his phone) No! ,{'bogo': 3},53,"Stop talking, stop talking, stop talking—",0.38080797,6,8,0.4
712,1042,dialog,GAZELLE,"I am Gazelle, and you are one hot dancer. ",{'bogo': 3},53,"Wow. You are one hot dancer, ",0.7571845,8,8,0.4
713,1043,dialog,CLAWHAUSER,"You have the app too?! (ecstatic) Oh, jeeeeez! ",{'bogo': 3},53,Did you think it was real? It looks so real! It's not—it's just a new app.,0.44750044,8,8,0.4
714,1044,dialog,BOGO,"Clawhauser, can't you see I'm working on the missing mammal cases?! ",{'bogo': 3},53,"Finally, we have fourteen missing mammal cases, ",0.6974778,24,8,0.4
715,1045,dialog,CLAWHAUSER,"Oh, yes of course! About that, sir... Officer Hopps just called... She found all of `em. ",{'bogo': 3},53,Officer Hopps? ,0.68987244,9,8,0.4
716,1047,dialog,GAZELLE,Wow! I'm impressed. ,{'bogo': 3},53,"Wow, ",0.45860714,16,8,0.4
717,1049,dialog,HOPPS,"Mayor Lionheart, you have the right to remain silent. Anything-- ",{'hopps': 3},54,"Mayor Lionheart, please, ",0.6757415,11,14,0.4
718,1050,dialog,LIONHEART,You don't understand. I was trying to protect the city. ,{'hopps': 3},54,"With all due respect, sir, a good cop is supposed to serve and protect—help the city, not tear it apart￼, ",0.5040731,14,14,0.4
719,1051,dialog,HOPPS,You were just trying to protect your job. ,{'hopps': 3},54,Your job is putting tickets on parked cars.,0.43537027,28,14,0.4
720,1052,dialog,LIONHEART,"No. Listen, we still don't know why this is happening. It could destroy Zootopia. ",{'hopps': 3},54,"The Zootopia I know is better than this. We don't just blindly assign blame. We don't know why these attacks keep happening, but it is irresponsible to label all predators as savages. We cannot let fear divide us. Please give me back the Zootopia I love.",0.6489102,14,14,0.4
721,1053,dialog,HOPPS,You have the right to remain silent. Anything you say can and will be used against you in a court of law... ,{'hopps': 3},54,WE RESERVE THE RIGHT TO REFUSE SERVICE TO ANYONE. So beat it.,0.41606885,25,14,0.4
722,1056,dialog,BOGO,"Ladies and Gentlemammals... 14 mammals went missing and all 14 have been found by our newest recruit, who will speak to you in a moment. But first, let me remind you-- ","{'bogo': 3, 'hopps': 22, 'nick': 11, 'bellwether': 3}",55,"Fourteen mammals went missing, and all fourteen have been found by our newest recruit, who will speak to you in a moment.",0.8979126,13,13,0.7037037037037037
723,1058,dialog,HOPPS,Rrrgh. I am so nervous... ,"{'bogo': 3, 'hopps': 22, 'nick': 11, 'bellwether': 3}",55,"I am so nervous, ",0.7802098,13,13,0.7037037037037037
724,1059,dialog,NICK,"Okay, press conference 101: You wanna look smart? ","{'bogo': 3, 'hopps': 22, 'nick': 11, 'bellwether': 3}",55,"Okay, Press Conference 101, ",0.6834632,13,13,0.7037037037037037
725,1060,dialog,,80. ,"{'bogo': 3, 'hopps': 22, 'nick': 11, 'bellwether': 3}",55,"A hundred tickets, ",0.50045526,24,13,0.7037037037037037
726,1061,dialog,NICK,"Answer their question with your own question and then answer that question. Like this, ""Excuse me. Officer Hopps, what can you tell us about the case?"" (pretending to be Hopps) ""Well, was this a tough case? Yes. Yes it was."" You see? ","{'bogo': 3, 'hopps': 22, 'nick': 11, 'bellwether': 3}",55,"No, actually, it's Officer Hopps, and I'm here to ask you some questions about a case.",0.7074241,2,13,0.7037037037037037
727,1062,dialog,HOPPS,You should be there with me. We did this together. ,"{'bogo': 3, 'hopps': 22, 'nick': 11, 'bellwether': 3}",55,"You should be up there with me. We did this together, ",0.85802424,13,13,0.7037037037037037
728,1063,dialog,NICK,"Well, am I a cop? No. No, I am not. ","{'bogo': 3, 'hopps': 22, 'nick': 11, 'bellwether': 3}",55,"Well, am I a cop? No. No, I'm not, ",0.9929931,13,13,0.7037037037037037
729,1064,dialog,HOPPS,"Funny you should say that, because I've been thinking... it would be nice to have a partner. ","{'bogo': 3, 'hopps': 22, 'nick': 11, 'bellwether': 3}",55,"Funny you should say that… because I've been thinking. It would be nice to have a partner, ",0.98558366,13,13,0.7037037037037037
730,1066,dialog,HOPPS,Here. In case you need something to write with. ,"{'bogo': 3, 'hopps': 22, 'nick': 11, 'bellwether': 3}",55,Here. In case you need something to write with.,1.0000001,13,13,0.7037037037037037
731,1067,dialog,BOGO,"At twenty-two hundred hours, we found all these missing animals... ","{'bogo': 3, 'hopps': 22, 'nick': 11, 'bellwether': 3}",55,"Finally, we have fourteen missing mammal cases, ",0.60759133,24,13,0.7037037037037037
732,1069,dialog,BELLWETHER,"Officer Hopps, it's time. ","{'bogo': 3, 'hopps': 22, 'nick': 11, 'bellwether': 3}",55,"Officer Hopps, it's time.",1.0000002,13,13,0.7037037037037037
733,1071,dialog,BOGO,"So now, I'll turn things over to the officer who cracked the case. Officer Judy Hopps. ","{'bogo': 3, 'hopps': 22, 'nick': 11, 'bellwether': 3}",55,"Officer Judy Hopps, ",0.713578,4,13,0.7037037037037037
734,1073,dialog,PRESS,Officer Hopps! / Over here! / Here! ,"{'bogo': 3, 'hopps': 22, 'nick': 11, 'bellwether': 3}",55,"Hey. Officer Hopps, ",0.82852083,24,13,0.7037037037037037
735,1074,dialog,HOPPS,(pointing to a REPORTER) Yes? ,"{'bogo': 3, 'hopps': 22, 'nick': 11, 'bellwether': 3}",55,A reporter interviewed Lionheart from jail.,0.36511108,20,13,0.7037037037037037
736,1075,dialog,REPORTER,What can you tell us about the animals that went savage? ,"{'bogo': 3, 'hopps': 22, 'nick': 11, 'bellwether': 3}",55,What can you tell us about the animals that went savage? ,1.0000002,13,13,0.7037037037037037
737,1076,dialog,HOPPS,"Well, the animals in question... (glances at Nick) Are they all different species? Yes. Yes they are. ","{'bogo': 3, 'hopps': 22, 'nick': 11, 'bellwether': 3}",55,"Well, the animals in question… Are they all different species? Yes. Yes, they are, ",0.7655765,13,13,0.7037037037037037
738,1078,dialog,REPORTER 2,"Okay, so what is the connection? ","{'bogo': 3, 'hopps': 22, 'nick': 11, 'bellwether': 3}",55,"Okay, what's the connection? ",0.9412347,13,13,0.7037037037037037
739,1079,dialog,HOPPS,"Well, all we know is that they are all members of the predator family. ","{'bogo': 3, 'hopps': 22, 'nick': 11, 'bellwether': 3}",55,"All we know is that they're all members of the predator family, ",0.98258084,13,13,0.7037037037037037
740,1080,dialog,ANOTHER REPORTER,"So, predators are the only ones going savage? ","{'bogo': 3, 'hopps': 22, 'nick': 11, 'bellwether': 3}",55,So predators are the only ones going savage? ,0.9909462,13,13,0.7037037037037037
741,1081,dialog,HOPPS,"That is accu-- Yes, that is accurate. Yes... ","{'bogo': 3, 'hopps': 22, 'nick': 11, 'bellwether': 3}",55,"That is accurate, ",0.40817747,13,13,0.7037037037037037
742,1082,dialog,REPORTER 3,Wow. Why is that happening? ,"{'bogo': 3, 'hopps': 22, 'nick': 11, 'bellwether': 3}",55,Why is that happening? ,0.75101197,13,13,0.7037037037037037
743,1083,dialog,HOPPS,We still don't know-- ,"{'bogo': 3, 'hopps': 22, 'nick': 11, 'bellwether': 3}",55,We still don't know—,0.8952768,13,13,0.7037037037037037
744,1085,dialog,HOPPS,"(trying to appease) Ah, it may have something to do with biology. ","{'bogo': 3, 'hopps': 22, 'nick': 11, 'bellwether': 3}",55,"BUT, but, but… it may have something to do with biology, ",0.5973634,13,13,0.7037037037037037
745,1087,dialog,REPORTER,What do you mean by that? ,"{'bogo': 3, 'hopps': 22, 'nick': 11, 'bellwether': 3}",55,What do you mean by that? ,0.99999976,13,13,0.7037037037037037
746,1088,dialog,HOPPS,"A biological component. You know, something in their DNA... ","{'bogo': 3, 'hopps': 22, 'nick': 11, 'bellwether': 3}",55,"A biological component. You know, something in their DNA, ",0.9843051,13,13,0.7037037037037037
747,1089,dialog,REPORTER 4,"(more aggressive) In their DNA? Can you elaborate on that, please? ","{'bogo': 3, 'hopps': 22, 'nick': 11, 'bellwether': 3}",55,"In their DNA? Can you elaborate￼ on that, please? ",0.6791772,13,13,0.7037037037037037
748,1090,dialog,HOPPS,"Yes. What I mean is, thousands of years ago... um... predators survived through their aggressive hunting instincts. For whatever reason, they seem to be reverting back to their primitive, savage ways. ","{'bogo': 3, 'hopps': 22, 'nick': 11, 'bellwether': 3}",55,"Thousands of years ago… predators survived through their aggressive hunting instincts. For whatever reason, they're reverting back to their savage ways.",0.8667443,13,13,0.7037037037037037
749,1092,dialog,REPORTER,Of course they did. ,"{'bogo': 3, 'hopps': 22, 'nick': 11, 'bellwether': 3}",55,Wait. Where'd they go? ,0.34982806,10,13,0.7037037037037037
750,1094,dialog,MEAN KID ANIMAL,"(during flashback) Aw, is he gonna cry. ","{'bogo': 3, 'hopps': 22, 'nick': 11, 'bellwether': 3}",55,"What're ya gonna do, cry? ",0.52906567,12,13,0.7037037037037037
751,1095,dialog,REPORTER,"(on Nick, as flashback ends) Officer Hopps, could it happen again? ","{'bogo': 3, 'hopps': 22, 'nick': 11, 'bellwether': 3}",55,"Officer Hopps, could it happen again? ",0.7753552,13,13,0.7037037037037037
752,1096,dialog,HOPPS,It is possible. So we must be vigilant. And we at the ZPD are prepared and are here to protect you... ,"{'bogo': 3, 'hopps': 22, 'nick': 11, 'bellwether': 3}",55,We must be vigilant￼. And we at the ZPD are prepared and are here to protect you.,0.7169031,13,13,0.7037037037037037
753,1098,dialog,PRESS,Will more mammals go savage? / What is being done to protect us? / Have you considered a mandatory quarantine on predators? ,"{'bogo': 3, 'hopps': 22, 'nick': 11, 'bellwether': 3}",55,Should all predators be quarantined? ,0.7451054,13,13,0.7037037037037037
754,1100,dialog,BELLWETHER,"Okay, thank you Officer Hopps, uh, that's all the time that we have. No more questions... ","{'bogo': 3, 'hopps': 22, 'nick': 11, 'bellwether': 3}",55,"Uh, thank you, Officer Hopps. Uh, no more questions.",0.9355478,13,13,0.7037037037037037
755,1102,dialog,HOPPS,Was I okay? ,"{'bogo': 3, 'hopps': 22, 'nick': 11, 'bellwether': 3}",55,Are you okay? ,0.7055947,7,13,0.7037037037037037
756,1103,dialog,BELLWETHER,"Oh, you did fine. ","{'bogo': 3, 'hopps': 22, 'nick': 11, 'bellwether': 3}",55,I'm fine.,0.53972983,15,13,0.7037037037037037
757,1105,dialog,HOPPS,(excited) That went so fast! I didn't get a chance to mention you or say anything about how we-- ,"{'bogo': 3, 'hopps': 22, 'nick': 11, 'bellwether': 3}",55,That went so fast. I didn't get a chance to mention you or say anything about—,0.6342453,13,13,0.7037037037037037
758,1106,dialog,NICK,"(upset) Oh, I think you said plenty. ","{'bogo': 3, 'hopps': 22, 'nick': 11, 'bellwether': 3}",55,"Oh, I think you said plenty, ",0.699973,13,13,0.7037037037037037
759,1107,dialog,HOPPS,What do you mean? ,"{'bogo': 3, 'hopps': 22, 'nick': 11, 'bellwether': 3}",55,What do you mean? ,1.0,13,13,0.7037037037037037
760,1108,dialog,NICK,"(sarcastic, hard) Clearly, there's a biological component? These predators may be reverting back to their primitive, savage ways. Are you serious? ","{'bogo': 3, 'hopps': 22, 'nick': 11, 'bellwether': 3}",55,These predators may be reverting back to their primitive savage ways.,0.7833362,13,13,0.7037037037037037
761,1109,dialog,HOPPS,"I just stated the facts of the case. I mean, it's not like a bunny could go savage... ","{'bogo': 3, 'hopps': 22, 'nick': 11, 'bellwether': 3}",55,"I mean, it's not like a bunny could go savage.",0.76727813,13,13,0.7037037037037037
762,1110,dialog,NICK,Right. But a fox could? Huh? ,"{'bogo': 3, 'hopps': 22, 'nick': 11, 'bellwether': 3}",55,"No, but a fox could, huh? ",0.95892656,13,13,0.7037037037037037
763,1111,dialog,HOPPS,"Nick, stop it. You're not like them. ","{'bogo': 3, 'hopps': 22, 'nick': 11, 'bellwether': 3}",55,"Stop it, Nick! You're not like them.",0.9794523,13,13,0.7037037037037037
764,1112,dialog,NICK,"Oh, there's a them now? ","{'bogo': 3, 'hopps': 22, 'nick': 11, 'bellwether': 3}",55,There's a them now? ,0.9255401,13,13,0.7037037037037037
765,1113,dialog,HOPPS,You know what I mean. You're not that kind of predator. ,"{'bogo': 3, 'hopps': 22, 'nick': 11, 'bellwether': 3}",55,You know what I mean. You're not that kind of predator.,0.9999999,13,13,0.7037037037037037
766,1114,dialog,NICK,The kind that needs to be muzzled? The kind that makes you think you need to carry around Fox Repellent? ,"{'bogo': 3, 'hopps': 22, 'nick': 11, 'bellwether': 3}",55,"The kind that needs to be muzzled? The kind that makes you think you need to carry around fox repellent? Yeah, don't think I didn't notice that little item the first time we met.",0.9700804,13,13,0.7037037037037037
767,1116,dialog,NICK,"Yeah, don't think I didn't notice that little item the first time we met. (escalating anger) So let me ask you a question. Are you afraid of me? (Hopps looks heartbroken) Do you think I might go nuts? Do you think I might go savage? Do you think I might try to... EAT YOU?! ","{'bogo': 3, 'hopps': 22, 'nick': 11, 'bellwether': 3}",55,"So, you scared of me? Think I might go nuts? Go savage? Think I might what… try to eat you? ",0.62225956,13,13,0.7037037037037037
768,1118,dialog,NICK,"(calm, hurt) ...I knew it. Just when I thought somebody actually believed in me... ","{'bogo': 3, 'hopps': 22, 'nick': 11, 'bellwether': 3}",55,"I knew it. Just when I thought somebody actually believed in me, ",0.76298803,13,13,0.7037037037037037
769,1120,dialog,NICK,Probably best if you don't have a predator as a partner. ,"{'bogo': 3, 'hopps': 22, 'nick': 11, 'bellwether': 3}",55,Probably best if you don't have a predator as a   partner.,1.0000001,13,13,0.7037037037037037
770,1122,dialog,HOPPS,No. Nick. Nick! ,"{'bogo': 3, 'hopps': 22, 'nick': 11, 'bellwether': 3}",55,No! Nick! ,0.91938925,19,13,0.7037037037037037
771,1123,dialog,REPORTER 5,Officer Hopps! Were you just threatened by that predator? ,"{'bogo': 3, 'hopps': 22, 'nick': 11, 'bellwether': 3}",55,Officer Hopps? ,0.69871694,9,13,0.7037037037037037
772,1124,dialog,HOPPS,No. He's my friend. ,"{'bogo': 3, 'hopps': 22, 'nick': 11, 'bellwether': 3}",55,What about him? Is that him? ,0.46494016,6,13,0.7037037037037037
773,1125,dialog,REPORTER 6,We can't even trust our own friends? ,"{'bogo': 3, 'hopps': 22, 'nick': 11, 'bellwether': 3}",55,"ZPD, Put Your Trust in Us.",0.40270036,14,13,0.7037037037037037
774,1126,dialog,HOPPS,That is not what I said! Please! ,"{'bogo': 3, 'hopps': 22, 'nick': 11, 'bellwether': 3}",55,All right! Enough! Shut it! ,0.46950868,20,13,0.7037037037037037
775,1127,dialog,REPORTERS,Are we safe? / Have any other foxes gone savage? ,"{'bogo': 3, 'hopps': 22, 'nick': 11, 'bellwether': 3}",55,"Come get 'em. But watch out, 'cause I'm a fox. And like you said in your dumb little stage play, we predators used to eat prey. And that killer instinct￼ is still in our Dunnahh.",0.65058243,12,13,0.7037037037037037
776,1130,dialog,FEMALE BOBCAT NEWS ANCHOR,More bad news in this city gripped by fear. ,{},56,"Really, it's a proud-scared combo￼. I mean, Zootopia. It's so far away and such a big city.",0.49512184,22,14,0.25
777,1132,dialog,FEMALE BOBCAT NEWS ANCHOR,"A caribou is in critical condition, the victim of a mauling by a savage polar bear. This-- the 27th such attack-- comes just one week after ZPD Officer Judy Hopps connected the violence to traditionally predatory animals. ",{},56,"Polar bear fur, ",0.46053353,5,14,0.25
778,1133,dialog,MALE MOOSE NEWS ANCHOR,"Meanwhile, a peace rally organized by pop star, Gazelle, was marred by protest. ",{},56,Have you seen Gazelle's new video—are you familiar with Gazelle? ,0.41307032,8,14,0.25
779,1135,dialog,PIG,"Go back to the forest, predator! ",{},56,"Go back to the forest, predator! ",0.9999999,14,14,0.25
780,1136,dialog,LEOPARD,I'm from the savannah! ,{},56,I'm from the savanna! ,0.83677906,14,14,0.25
781,1138,dialog,GAZELLE,"Zootopia is a unique place. It's a crazy, beautiful, diverse city where we celebrate our differences. (gestures to PROTESTERS in background) This is not the Zootopia I know. ",{},56,"Really, it's a proud-scared combo￼. I mean, Zootopia. It's so far away and such a big city.",0.7140493,22,14,0.25
782,1140,dialog,GAZELLE,The Zootopia I know is better than this. ,{},56,I thought in Zootopia anyone could be anything.,0.6801872,4,14,0.25
783,1141,dialog,,86. ,{},56,"A hundred tickets, ",0.4955081,24,14,0.25
784,1142,dialog,GAZELLE,We don't just blindly assign blame. We don't know why these attacks keep happening... ,{},56,"The Zootopia I know is better than this. We don't just blindly assign blame. We don't know why these attacks keep happening, but it is irresponsible to label all predators as savages. We cannot let fear divide us. Please give me back the Zootopia I love.",0.57376736,14,14,0.25
785,1144,dialog,GAZELLE,...but it is irresponsible to label all predators as savages. ,{},56,So predators are the only ones going savage? ,0.7637952,13,14,0.25
786,1145,dialog,MRS. OTTERTON,That's not my Emmitt. ,{},56,Please. There's got to be somebody to find my Emmitt.,0.73851365,28,14,0.25
787,1147,dialog,GAZELLE,We cannot let fear divide us. Please-- give me back the Zootopia I love... ,{},56,"Really, it's a proud-scared combo￼. I mean, Zootopia. It's so far away and such a big city.",0.65356016,22,14,0.25
788,1149,dialog,BOGO,Come on Hopps. The new Mayor wants to see us. ,"{'bogo': 2, 'hopps': 1}",57,"Come on, Hopps.The new mayor wants to see us.",0.98804677,14,14,0.6666666666666666
789,1150,dialog,HOPPS,The Mayor? Why? ,"{'bogo': 2, 'hopps': 1}",57,Let's not tell the mayor just yet—,0.6866852,28,14,0.6666666666666666
790,1151,dialog,BOGO,It would seem you've arrived. ,"{'bogo': 2, 'hopps': 1}",57,"It would seem you've arrived, ",0.9590805,14,14,0.6666666666666666
791,1153,dialog,HOPPS,Clawhauser? What're you doing? ,"{'hopps': 2, 'bogo': 1}",58,Clawhauser? What're you doing? ,1.0000001,14,14,0.8
792,1154,dialog,CLAWHAUSER,"Um, they thought it would be better if a predator such as myself wasn't the first face you that you see when you walk into the ZPD. ","{'hopps': 2, 'bogo': 1}",58,"Oh, they thought it would be better if a predator such as myself wasn't the first face you see when you walk into the ZPD. So they're moving me to Records downstairs. By the boiler, ",0.7867849,14,14,0.8
793,1155,dialog,HOPPS,What? ,"{'hopps': 2, 'bogo': 1}",58,What? ,1.0,19,14,0.8
794,1156,dialog,CLAWHAUSER,They're gonna move me to Records. It's downstairs. By the boiler. ,"{'hopps': 2, 'bogo': 1}",58,"Oh, they thought it would be better if a predator such as myself wasn't the first face you see when you walk into the ZPD. So they're moving me to Records downstairs. By the boiler, ",0.61331826,14,14,0.8
795,1158,dialog,BOGO,Hopps! ,"{'hopps': 2, 'bogo': 1}",58,Hopps. Now! ,0.91166574,14,14,0.8
796,1162,dialog,HOPPS,Um... I don't understand. ,"{'hopps': 4, 'bellwether': 2, 'bogo': 2}",59,I don't understand.,0.7601797,14,14,1.0
797,1163,dialog,BELLWETHER,"Our city is 90% prey, Judy. And right now they're just really scared. You're a hero to them. They trust you. And so that's why Chief Bogo and I want you to be the public face of the ZPD. ","{'hopps': 4, 'bellwether': 2, 'bogo': 2}",59,"And right now, they're just really scared. You're a hero to them. They trust you. And so that's why Chief Bogo and I want you to be the public face of the ZPD.",0.7942877,14,14,1.0
798,1165,dialog,HOPPS,"(struggling to find words) I'm not... I'm not a hero. I came here to make the world a better place, but I think I broke it. ","{'hopps': 4, 'bellwether': 2, 'bogo': 2}",59,"I'm not—I'm not a hero, ",0.7046068,14,14,1.0
799,1166,dialog,BOGO,"Don't give yourself so much credit, Hopps. The world has always been broken. That's why we need good cops-- like you. ","{'hopps': 4, 'bellwether': 2, 'bogo': 2}",59,The world has always been broken. That's why we need good cops like you.,0.7836714,14,14,1.0
800,1167,dialog,HOPPS,"With all due respect, sir, a good cop is supposed to serve and protect-- help the city. Not tear it apart. (deep sigh) I don't deserve this badge. ","{'hopps': 4, 'bellwether': 2, 'bogo': 2}",59,"With all due respect, sir, a good cop is supposed to serve and protect—help the city, not tear it apart￼, ",0.79811037,14,14,1.0
801,1169,dialog,BOGO,Hopps. ,"{'hopps': 4, 'bellwether': 2, 'bogo': 2}",59,"Hopps, ",0.9554089,14,14,1.0
802,1170,dialog,BELLWETHER,"Judy, you've worked so hard to get here. It's what you've wanted since you were a kid. You can't quit... ","{'hopps': 4, 'bellwether': 2, 'bogo': 2}",59,"Judy. This is what you've always wanted. Since you were a kid… you can't quit…, ",0.867143,14,14,1.0
803,1171,dialog,HOPPS,Thank you for the opportunity. ,"{'hopps': 4, 'bellwether': 2, 'bogo': 2}",59,"Thank you for the opportunity, ",0.91395557,14,14,1.0
804,1174,dialog,HOPPS,A dozen carrots. ,{'hopps': 13},60,"Four dozen carrots, ",0.92659813,15,15,0.8333333333333334
805,1175,dialog,RABBIT MOM,Thanks! ,{'hopps': 13},60,"Thank you, ",0.57175726,9,15,0.8333333333333334
806,1176,dialog,HOPPS,Have a nice day. ,{'hopps': 13},60,Have a nice day.,0.99999994,15,15,0.8333333333333334
807,1177,dialog,RABBIT MOM,(to daughter) Come on. ,{'hopps': 13},60,You come here unannounced… on the day my daughter is to be married? ,0.47526604,6,15,0.8333333333333334
808,1179,dialog,STU HOPPS,"Hey there, Jude-- Jude the dude, remember that one? How we doin? ",{'hopps': 13},60,"Hey there, Jude—Jude the Dude, remember that one? How we doin'? ",0.9812996,15,15,0.8333333333333334
809,1180,dialog,HOPPS.,I'm fine. ,{'hopps': 13},60,I'm fine.,1.0,15,15,0.8333333333333334
810,1181,dialog,BONNIE HOPPS,You are not fine. Your ears are droopy. ,{'hopps': 13},60,"You are not fine. Your ears are droopy, ",0.9966404,15,15,0.8333333333333334
811,1183,dialog,HOPPS,Why did I think I could make a difference? ,{'hopps': 13},60,Why did I think I could make a difference? ,1.0000001,15,15,0.8333333333333334
812,1184,dialog,STU HOPPS,"Because you're a trier, that's why. ",{'hopps': 13},60,"Well, because you're a trier, that's why, ",0.96267444,15,15,0.8333333333333334
813,1185,dialog,BONNIE HOPPS,You've always been a trier. ,{'hopps': 13},60,"You've always been a trier, ",0.9928203,15,15,0.8333333333333334
814,1186,dialog,HOPPS,"Oh, I tried. And it made life so much worse for so many innocent predators. ",{'hopps': 13},60,"Yeah. I tried, and I made life so much worse for so many innocent predators.",0.9391883,15,15,0.8333333333333334
815,1188,dialog,STU HOPPS,"Oh, not all of them, though. Speak of the devil. Right on time. ",{'hopps': 13},60,Speak of the devil. Right on time.,0.7787146,15,15,0.8333333333333334
816,1190,dialog,HOPPS,Is that... Gideon Grey? ,{'hopps': 13},60,Is that… Gideon Grey? ,0.98306817,15,15,0.8333333333333334
817,1191,dialog,STU HOPPS,Yep. It sure is. We work with him now. ,{'hopps': 13},60,We work with him now.,0.6858733,15,15,0.8333333333333334
818,1192,dialog,BONNIE HOPPS,He's our partner. And we never would have considered it had you not opened our minds. ,{'hopps': 13},60,"He's our partner! And we'd never have considered it had you not opened our minds, ",0.9731873,15,15,0.8333333333333334
819,1193,dialog,STU HOPPS,"That's right. I mean, Gid's turned into one of the top pastry chefs in the tri-burrows. ",{'hopps': 13},60,Gid's turned into one of the top pastry chefs in the triboroughs.,0.88688487,15,15,0.8333333333333334
820,1194,dialog,HOPPS,"That's really cool, you guys. ",{'hopps': 13},60,"I love you guys, ",0.46535036,22,15,0.8333333333333334
821,1196,dialog,HOPPS,Gideon Grey. I'll be darned. ,{'hopps': 13},60,"Gideon Grey, ",0.9079495,15,15,0.8333333333333334
822,1197,dialog,ADULT GIDEON GREY,Hey Judy-- I'd like to say I'm sorry for the way I behaved in my youth. I had a lotta self-doubt that manifested itself in the form of unchecked rage and aggression. I was a major jerk. ,{'hopps': 13},60,I'd like to say sorry for the way I behaved in my youth. I had a lot of self-doubt that manifested￼ itself in the form of unchecked￼ rage and aggression. I was a major jerk.,0.7473737,15,15,0.8333333333333334
823,1198,dialog,HOPPS,"Well, I know a thing or two about being a jerk... ",{'hopps': 13},60,"I know a thing or two about being a jerk, ",0.9554955,15,15,0.8333333333333334
824,1199,dialog,ADULT GIDEON GREY,Anyhow-- I brought you all these pies. ,{'hopps': 13},60,"Anyhow, I brought you all these pies, ",0.97092915,15,15,0.8333333333333334
