,index,type,title,text,chars,scene,text_in_book,score,chapter,vote_chapter,vote_percentage
564,820,dialog,CLAWHAUSER,"Okay, we're sending back up! Hopps? ","{'hopps': 14, 'nick': 12, 'bogo': 9}",43,Sending back up! Hopps? HOPPS? ! ,0.9041901,8,9,0.4358974358974359
565,822,dialog,HOPPS,There! Head to the skytrams! ,"{'hopps': 14, 'nick': 12, 'bogo': 9}",43,Head to the skytrams! ,0.9364539,8,9,0.4358974358974359
566,824,dialog,NICK,Get in! Carrots? Carrots! ,"{'hopps': 14, 'nick': 12, 'bogo': 9}",43,Get in! Carrots? Carrots! ,1.0000002,8,9,0.4358974358974359
567,826,dialog,HOPPS,Go! ,"{'hopps': 14, 'nick': 12, 'bogo': 9}",43,Go! ,1.0,8,9,0.4358974358974359
568,828,dialog,NICK,"No, no, no! ","{'hopps': 14, 'nick': 12, 'bogo': 9}",43,No! ,0.5935158,4,9,0.4358974358974359
569,830,dialog,NICK,"Buddy, one predator to another--                      * ","{'hopps': 14, 'nick': 12, 'bogo': 9}",43,Now predator and prey live in harmony.,0.64611995,1,9,0.4358974358974359
570,832,dialog,NICK,"Now, I can tell you're a little tense, so I'm just gonna give you a little personal space-- ","{'hopps': 14, 'nick': 12, 'bogo': 9}",43,"I can tell you're tense, so I'm just gonna give you a little personal space, ",0.93395734,8,9,0.4358974358974359
571,834,dialog,NICK,"Rabbit, whatever you do, do not let go! ","{'hopps': 14, 'nick': 12, 'bogo': 9}",43,"Rabbit, whatever you do, do not let go! ",1.0000001,8,9,0.4358974358974359
572,835,dialog,HOPPS,I'm gonna let go! ,"{'hopps': 14, 'nick': 12, 'bogo': 9}",43,I'm gonna let go! ,1.0000002,8,9,0.4358974358974359
573,836,dialog,NICK,"No, you what? No, I said-- listen-- noooo! ","{'hopps': 14, 'nick': 12, 'bogo': 9}",43,No… you what? You must have misunderstood me. I said don't—,0.5826949,8,9,0.4358974358974359
574,837,dialog,HOPPS,"One, two-- ","{'hopps': 14, 'nick': 12, 'bogo': 9}",43,"One, two, ",0.9121327,8,9,0.4358974358974359
575,839,dialog,NICK,Carrots. You saved my life. ,"{'hopps': 14, 'nick': 12, 'bogo': 9}",43,Carrots! ,0.7771509,19,9,0.4358974358974359
576,840,dialog,HOPPS,Well. That's what we do at the ,"{'hopps': 14, 'nick': 12, 'bogo': 9}",43,We're doing everything we can.,0.43142456,11,9,0.4358974358974359
577,841,dialog,ZP...,(the branch snaps) Deeeeeeeeeeeee..... ,"{'hopps': 14, 'nick': 12, 'bogo': 9}",43,"All right, Officer Hopps. Let's see those teeth! ",0.39636233,22,9,0.4358974358974359
578,843,dialog,BOGO,"Well, this should be good. ","{'hopps': 14, 'nick': 12, 'bogo': 9}",43,"Well, this should be good, ",0.93495774,8,9,0.4358974358974359
579,845,dialog,HOPPS,"I thought this was just a missing mammal case, but it's way bigger. ","{'hopps': 14, 'nick': 12, 'bogo': 9}",43,"Finally, we have fourteen missing mammal cases, ",0.64889264,24,9,0.4358974358974359
580,846,dialog,,64. ,"{'hopps': 14, 'nick': 12, 'bogo': 9}",43,Two… nine… ,0.45651194,4,9,0.4358974358974359
581,847,dialog,HOPPS,"Mr. Otterton did not just disappear. I believe he and this jaguar, they... went savage, Sir. ","{'hopps': 14, 'nick': 12, 'bogo': 9}",43,"I thought this was just a missing mammal case, but it's way bigger. Mr. Otterton did not just disappear. I believe he and this jaguar… they went savage, sir.",0.8682095,9,9,0.4358974358974359
582,848,dialog,BOGO,"(scoffing) Savage? This isn't the Stone Age, Hopps. Animals don't go savage. ","{'hopps': 14, 'nick': 12, 'bogo': 9}",43,"Savage? This isn't the Stone Age, Hopps. Animals don't go savage.",0.88737327,9,9,0.4358974358974359
583,849,dialog,HOPPS,"I thought so too, `til I saw this: ","{'hopps': 14, 'nick': 12, 'bogo': 9}",43,"I thought so, too, until I saw this.",0.77290154,9,9,0.4358974358974359
584,851,dialog,HOPPS,What? He was right here... ,"{'hopps': 14, 'nick': 12, 'bogo': 9}",43,"He was right here, ",0.7358958,9,9,0.4358974358974359
585,852,dialog,BOGO,"(not buying it) The ""savage"" jaguar. ","{'hopps': 14, 'nick': 12, 'bogo': 9}",43,"The ‘savage' jaguar, ",0.8276075,9,9,0.4358974358974359
586,853,dialog,HOPPS,"Sir, I know what I saw-- he almost killed us. ","{'hopps': 14, 'nick': 12, 'bogo': 9}",43,"Sir, I know what I saw. He almost killed us, ",0.96817684,9,9,0.4358974358974359
587,854,dialog,BOGO,"Or maybe any aggressive predator looks savage to you rabbits. (calls out, to cops) Let's go. ","{'hopps': 14, 'nick': 12, 'bogo': 9}",43,"Or maybe an aggressive predator looks savage to you rabbits, ",0.8811397,9,9,0.4358974358974359
588,855,dialog,HOPPS,"Wait-- Sir, I'm not the only one who saw him! (to Nick) Nick! ","{'hopps': 14, 'nick': 12, 'bogo': 9}",43,Nick! ,0.7402713,13,9,0.4358974358974359
589,857,dialog,BOGO,(incredulous) You think I'm going to believe a fox? ,"{'hopps': 14, 'nick': 12, 'bogo': 9}",43,You think I'm going to believe a fox? ,0.96264154,9,9,0.4358974358974359
590,858,dialog,HOPPS,Well he was a key witness and I enlisted-- ,"{'hopps': 14, 'nick': 12, 'bogo': 9}",43,"Well, he was a key witness, and I enlisted￼ his services, ",0.7753715,9,9,0.4358974358974359
591,859,dialog,BOGO,(the last straw) Two days to find the otter... ,"{'hopps': 14, 'nick': 12, 'bogo': 9}",43,We found our otter.,0.64939195,11,9,0.4358974358974359
592,860,dialog,,65. ,"{'hopps': 14, 'nick': 12, 'bogo': 9}",43,"A hundred tickets, ",0.4478278,24,9,0.4358974358974359
593,861,dialog,BOGO,or you quit... that was the deal. Badge. ,"{'hopps': 14, 'nick': 12, 'bogo': 9}",43,"Two days to find the otter… or you quit… that was the deal. Badge, ",0.6056018,9,9,0.4358974358974359
594,863,dialog,HOPPS,"But, Sir, we... ","{'hopps': 14, 'nick': 12, 'bogo': 9}",43,"Sir, we…",0.7990415,9,9,0.4358974358974359
595,864,dialog,BOGO,Badge. ,"{'hopps': 14, 'nick': 12, 'bogo': 9}",43,"Badge, ",0.900254,9,9,0.4358974358974359
596,866,dialog,NICK,"Uh, no. ","{'hopps': 14, 'nick': 12, 'bogo': 9}",43,"Uh, no, ",0.9110165,9,9,0.4358974358974359
597,868,dialog,BOGO,"What did you say, fox? ","{'hopps': 14, 'nick': 12, 'bogo': 9}",43,"What did you say,fox? ",1.0,9,9,0.4358974358974359
598,869,dialog,NICK,"Sorry, what I said was, ""no."" She will not be giving you that badge. Look, you gave her a clown vest and a three-wheel joke-mobile and two days to solve a case you guys haven't cracked in two weeks? Yeah, no wonder she needed to get help from a fox, none of you guys were gonna help her, were you? ","{'hopps': 14, 'nick': 12, 'bogo': 9}",43,"Look, you gave her a clown vest and a three-wheel joke-mobile￼ and two days to solve a case you guys haven't cracked in two weeks? Yeah, no wonder she needed to get help from a fox. None of you guys were gonna help her, were you? ",0.75732577,9,9,0.4358974358974359
599,871,dialog,NICK,"Here's the thing Chief, you gave her the 48 hours, so technically we still have 10 left to find our Mr. Otterton... and that's exactly what we're gonna do, so if you'll excuse us... we have a very big lead to follow and a case to crack. Good day. ","{'hopps': 14, 'nick': 12, 'bogo': 9}",43,"Here's the thing, Chief. You gave her forty-eight hours, so technically we still have ten left to find our Mr. Otterton… and that's exactly what we are gonna do. So if you'll excuse us… we have a very big lead￼ to follow and a case to crack. Good day.",0.95529366,9,9,0.4358974358974359
600,873,dialog,NICK,Officer Hopps? ,"{'hopps': 14, 'nick': 12, 'bogo': 9}",43,Officer Hopps? ,0.9999998,9,9,0.4358974358974359
601,876,dialog,HOPPS,Thank you. ,"{'hopps': 3, 'nick': 3}",44,"Thank you, ",0.7114743,9,9,1.0
602,877,dialog,NICK,Never let `em see that they get to you. ,"{'hopps': 3, 'nick': 3}",44,"Never let them see that they get to you, ",0.9018498,9,9,1.0
603,879,dialog,HOPPS,"So, things do get to you... ","{'hopps': 3, 'nick': 3}",44,So things get to you? ,0.82499117,9,9,1.0
604,880,dialog,NICK,"No... I mean, not anymore. But I was small and emotionally unbalanced like you once. ","{'hopps': 3, 'nick': 3}",44,But I was small and emotionally unbalanced like you once.,0.849627,9,9,1.0
605,881,dialog,HOPPS,Har-har. ,"{'hopps': 3, 'nick': 3}",44,"Har-har, ",0.9446486,9,9,1.0
606,882,dialog,NICK,"(retreating into the memory) No, it's true. I think was 8, or maybe 9, and all I wanted to do was join the Junior Ranger Scouts. ","{'hopps': 3, 'nick': 3}",44,"No, it's true. I think I was eight, maybe nine, and all I wanted to do was join the Junior Ranger Scouts￼.",0.8872689,9,9,1.0
607,884,dialog,NICK,"...so, my mom scraped together enough money to buy me a brand new uniform because, by God, I was gonna fit in. ",{'nick': 1},45,So my mom scraped together enough money to buy me a brand-new uniform.,0.9180691,9,9,1.0
608,886,dialog,NICK,Even if I was the only predator in the troop-- ,{'nick': 1},46,You know what I mean. You're not that kind of predator.,0.58676404,13,13,1.0
609,888,dialog,NICK,...the only fox. ,"{'nick': 10, 'hopps': 7}",47,Dumb fox.,0.78111243,21,9,0.5714285714285714
610,889,dialog,MEAN KID ANIMAL,"Okay, Nick! ","{'nick': 10, 'hopps': 7}",47,Nick! ,0.8326687,13,9,0.5714285714285714
611,890,dialog,NICK,I was gonna be part of a pack. ,"{'nick': 10, 'hopps': 7}",47,"I was gonna be part of a pack, ",0.9846519,9,9,0.5714285714285714
612,891,dialog,MEAN KID ANIMAL,Ready for initiation? ,"{'nick': 10, 'hopps': 7}",47,"We have some new recruits with us this morning, ",0.45393056,20,9,0.5714285714285714
613,892,dialog,YOUNG NICK,Yeah! Pretty much born ready. ,"{'nick': 10, 'hopps': 7}",47,You ready to make the world a better place? ,0.44398725,24,9,0.5714285714285714
614,894,dialog,NICK,I was so proud. ,"{'nick': 10, 'hopps': 7}",47,"It's a real proud day for us little guys, ",0.49222255,22,9,0.5714285714285714
615,896,dialog,MEAN KID ANIMAL,Okay. Now raise your right hand and deliver the oath. ,"{'nick': 10, 'hopps': 7}",47,WE RESERVE THE RIGHT TO REFUSE SERVICE TO ANYONE. So beat it.,0.41593128,25,9,0.5714285714285714
616,897,dialog,YOUNG NICK,"I, Nicholas Wilde, promise to be brave, loyal, helpful, and trustworthy. ","{'nick': 10, 'hopps': 7}",47,Wilde. Nick Wilde.,0.69955057,25,9,0.5714285714285714
617,898,dialog,MEAN KID ANIMAL,Even though you're a fox? ,"{'nick': 10, 'hopps': 7}",47,"No, but a fox could, huh? ",0.73828787,13,9,0.5714285714285714
618,899,dialog,YOUNG NICK,What? ,"{'nick': 10, 'hopps': 7}",47,What? ,1.0,19,9,0.5714285714285714
619,901,dialog,YOUNG NICK,"No! What did I do wrong, you guys?! No! Please tell me, what did I do wrong?! ","{'nick': 10, 'hopps': 7}",47,No! ,0.46015412,4,9,0.5714285714285714
620,903,dialog,YOUNG NICK,(muzzled) What did I do?! ,"{'nick': 10, 'hopps': 7}",47,"The kind that needs to be muzzled? The kind that makes you think you need to carry around fox repellent? Yeah, don't think I didn't notice that little item the first time we met.",0.5310738,13,9,0.5714285714285714
621,904,dialog,MEAN KID ANIMAL,"If you thought we would ever trust a fox without a muzzle, you're even dumber than you look. ","{'nick': 10, 'hopps': 7}",47,"If you thought we'd ever trust a fox without a muzzle, you're even dumber than you look, ",0.9962466,9,9,0.5714285714285714
622,906,dialog,MEAN KID ANIMAL,"Aw, is he gonna cry? ","{'nick': 10, 'hopps': 7}",47,"What're ya gonna do, cry? ",0.6426018,12,9,0.5714285714285714
623,908,dialog,NICK,"I learned two things that day. One, I was never gonna let anyone see that they got to me. ","{'nick': 10, 'hopps': 7}",47,"I learned two things that day, ",0.76709944,9,9,0.5714285714285714
624,910,dialog,HOPPS,...And two? ,"{'nick': 10, 'hopps': 7}",47,And two? ,0.8531391,9,9,0.5714285714285714
625,911,dialog,NICK,"If the world's only gonna see a fox as shifty and untrustworthy, there's no point in trying to be anything else. ","{'nick': 10, 'hopps': 7}",47,You think I'm going to believe a fox? ,0.6887863,9,9,0.5714285714285714
626,912,dialog,HOPPS,"Nick, you are so much more than that... ","{'nick': 10, 'hopps': 7}",47,"Nick, I'm glad you told me, ",0.7028745,9,9,0.5714285714285714
627,914,dialog,NICK,"Boy, look at that traffic down there. (putting on radio voice) How about we go out to Chuck in Traffic Central-- Chuck, how are things looking on the Jam Cams? ","{'nick': 10, 'hopps': 7}",47,"Chuck, how are things looking on those Jam Cams? ",0.6687701,9,9,0.5714285714285714
628,915,dialog,HOPPS,"Nick, I'm glad you told me... ","{'nick': 10, 'hopps': 7}",47,"Nick, I'm glad you told me, ",0.9578135,9,9,0.5714285714285714
629,916,dialog,NICK,(lightbulb moment!) The Jam Cams...! ,"{'nick': 10, 'hopps': 7}",47,Wait! The Jam Cams! ,0.806473,9,9,0.5714285714285714
630,917,dialog,HOPPS,"Seriously, it's okay... ","{'nick': 10, 'hopps': 7}",47,"Seriously, it's okay, ",0.87913185,9,9,0.5714285714285714
631,918,dialog,NICK,No-n-shh-shush! There are traffic cameras everywhere. All over the canopy. Whatever happened to that jaguar-- ,"{'nick': 10, 'hopps': 7}",47,"N-no, shh-shush! There are traffic cameras everywhere. All over the canopy. Whatever happened to that jaguar—",0.98307836,9,9,0.5714285714285714
632,919,dialog,HOPPS,The traffic cams would have caught it! ,"{'nick': 10, 'hopps': 7}",47,The traffic cameras would have caught it! ,0.9707561,9,9,0.5714285714285714
633,920,dialog,NICK,Bingo! ,"{'nick': 10, 'hopps': 7}",47,Bingo! ,1.0000002,9,9,0.5714285714285714
634,922,dialog,HOPPS,"Pretty sneaky, Slick. ","{'nick': 10, 'hopps': 7}",47,"Pretty sneaky, Slick.",1.0000001,9,9,0.5714285714285714
635,923,dialog,NICK,"However. If you didn't have access to the system before, I doubt Chief Buffalo Butt is gonna let you into it now. ","{'nick': 10, 'hopps': 7}",47,"However. If you didn't have access to the system before, I doubt Chief Buffalo Butt is gonna give it to you now.",0.96239185,9,9,0.5714285714285714
636,924,dialog,HOPPS,"(beat, then) No... But I have a friend at City Hall who might. ","{'nick': 10, 'hopps': 7}",47,No. But I've got a friend at city hall who might! ,0.7948533,9,9,0.5714285714285714
637,926,dialog,BELLWETHER,Sir? If we could just review these very important-- (almost drops binders) Sir? ,"{'bellwether': 4, 'hopps': 1}",48,If we could just review these very important—,0.58212334,10,10,1.0
638,928,dialog,BELLWETHER,"Ooo, I'm so sorry... sir?! ","{'bellwether': 4, 'hopps': 1}",48,"Oh, I'm sorry… sir! ",0.7616228,10,10,1.0
639,929,dialog,LIONHEART,"Okay. I heard you, Bellwether. Just take care of it! (setting another binder atop her stack) Please. And clear my afternoon, I'm going out. ","{'bellwether': 4, 'hopps': 1}",48,"Just take care of it, okay? ",0.44349948,10,10,1.0
640,930,dialog,BELLWETHER,"No, no! But, sir, you do have a meeting with Herds and Grazing... sir, if I could just-- ","{'bellwether': 4, 'hopps': 1}",48,"But, sir, you have a meeting with Herds and Grazing… Sir—",0.8806339,10,10,1.0
641,932,dialog,BELLWETHER,"Oh, mutton chops. ","{'bellwether': 4, 'hopps': 1}",48,"Oh, mutton chops, ",0.990667,10,10,1.0
642,934,dialog,HOPPS,Assistant Mayor Bellwether? We need your help. ,"{'bellwether': 4, 'hopps': 1}",48,"Assistant Mayor Bellwether, ",0.92306966,10,10,1.0
643,936,dialog,HOPPS,We just need to get into the traffic cam database. ,"{'hopps': 12, 'nick': 11, 'bellwether': 6}",49,"We just need to get into the traffic camera database, ",0.9521628,10,10,0.90625
644,938,dialog,NICK,"(mouths, to Hopps) So fluffy! ","{'hopps': 12, 'nick': 11, 'bellwether': 6}",49,Sooo fluffy! ,0.6461519,10,10,0.90625
645,939,dialog,HOPPS,Hey! ,"{'hopps': 12, 'nick': 11, 'bellwether': 6}",49,Hey! ,1.0000001,12,10,0.90625
646,940,dialog,NICK,Sheep never let me this close. ,"{'hopps': 12, 'nick': 11, 'bellwether': 6}",49,Sheep never let me this close—so fluffy—like cotton candy—,0.6844341,10,10,0.90625
647,941,dialog,HOPPS,You can't just touch a sheep's wool... ,"{'hopps': 12, 'nick': 11, 'bellwether': 6}",49,Sheep never let me this close—so fluffy—like cotton candy—,0.6051037,10,10,0.90625
648,943,dialog,BELLWETHER,Where to? ,"{'hopps': 12, 'nick': 11, 'bellwether': 6}",49,Where to? ,0.9999997,10,10,0.90625
649,944,dialog,HOPPS,"Rainforest District, Vine and Tujunga. ","{'hopps': 12, 'nick': 11, 'bellwether': 6}",49,Rainforest District. Vine and Tujunga.,0.98628753,10,10,0.90625
650,946,dialog,BELLWETHER,"There! Traffic cams for the whole city. This is so exciting, actually. Well, you know, I never get to do anything this important. ","{'hopps': 12, 'nick': 11, 'bellwether': 6}",49,"We just need to get into the traffic camera database, ",0.6117081,10,10,0.90625
651,947,dialog,HOPPS,But you're the Assistant Mayor of Zootopia. ,"{'hopps': 12, 'nick': 11, 'bellwether': 6}",49,"You're the assistant mayor of Zootopia, ",0.959277,10,10,0.90625
652,948,dialog,BELLWETHER,"Oh, I'm more of a glorified secretary. I think Mayor Lionheart just wanted the sheep vote... (then, cheerily) But he did give me that nice mug. ","{'hopps': 12, 'nick': 11, 'bellwether': 6}",49,I think Mayor Lionheart just wanted the sheep vote… But he did get me that nice mug.,0.90306294,10,10,0.90625
653,950,dialog,BELLWETHER,Feels good to be appreciated. ,"{'hopps': 12, 'nick': 11, 'bellwether': 6}",49,"Absolutely, and more! Everyone's so nice. And I feel like I'm really making a difference—",0.40545964,27,10,0.90625
654,951,dialog,LIONHEART,Smellwether?! ,"{'hopps': 12, 'nick': 11, 'bellwether': 6}",49,Smellwether! ,0.9258847,10,10,0.90625
655,953,dialog,BELLWETHER,"That's a fun little name he likes to use. I called him Lionfart once. He did not care for that, let me tell you. It was not a good day for me. (pressing intercom button) Yes, sir? ","{'hopps': 12, 'nick': 11, 'bellwether': 6}",49,"Oh, that's a fun little name he uses. I called him Lionfart once. He didn't care for that.",0.85199463,10,10,0.90625
656,954,dialog,LIONHEART,I thought you were going to cancel my afternoon?! ,"{'hopps': 12, 'nick': 11, 'bellwether': 6}",49,I thought you were going to cancel my afternoon! ,0.9759617,10,10,0.90625
657,955,dialog,BELLWETHER,"Oh, dear. I better go -- (to Hopps, while leaving) Let me know what you find. It was really nice for me to be-- ","{'hopps': 12, 'nick': 11, 'bellwether': 6}",49,"Oh, dear… I better go. Let me know what you find. It was really nice for me to—",0.65772754,10,10,0.90625
658,956,dialog,LIONHEART,"While we're young, Smellwether! ","{'hopps': 12, 'nick': 11, 'bellwether': 6}",49,"While we're young, Smellwether! ",1.0000001,10,10,0.90625
659,958,dialog,NICK,You think when she goes to sleep she counts herself? ,"{'hopps': 12, 'nick': 11, 'bellwether': 6}",49,She is scared! ,0.3507395,12,10,0.90625
660,959,dialog,HOPPS,"Shush. Okay, traffic cams... (looking at computer) Tujunga, Tujunga... we're in. ","{'hopps': 12, 'nick': 11, 'bellwether': 6}",49,"Okay. Traffic cameras. Tujunga, Tujunga… we're in.",0.90706676,10,10,0.90625
661,961,dialog,HOPPS,Who are these guys? ,"{'hopps': 12, 'nick': 11, 'bellwether': 6}",49,Who are these guys? ,1.0,10,10,0.90625
662,962,dialog,NICK,Timberwolves. Look at these dumdums. ,"{'hopps': 12, 'nick': 11, 'bellwether': 6}",49,Timber wolves. Look at these dum-dums.,0.67564535,10,10,0.90625
663,964,dialog,NICK,Betcha a nickel one of em's gonna howl. ,"{'hopps': 12, 'nick': 11, 'bellwether': 6}",49,"Bet you a nickel one of them's gonna howl, ",0.88112605,10,10,0.90625
664,966,dialog,NICK,And there it is. What is it with wolves and the howling? It's like-- ,"{'hopps': 12, 'nick': 11, 'bellwether': 6}",49,There it is. What is with wolves and howling? ,0.95629096,10,10,0.90625
665,967,dialog,HOPPS,(light-bulb moment) Howlers! Night howlers! That's what Manchas was afraid of... wolves! The wolves are the night howlers. If they took Manchas... ,"{'hopps': 12, 'nick': 11, 'bellwether': 6}",49,That's what Manchas was afraid of—wolves!The wolves are the night howlers. If they took Manchas—,0.90897506,10,10,0.90625
666,968,dialog,NICK,...I bet they took Otterton too. ,"{'hopps': 12, 'nick': 11, 'bellwether': 6}",49,"I bet they took Otterton, too, ",0.9866077,10,10,0.90625
667,969,dialog,HOPPS,All we gotta do is find out where they went. ,"{'hopps': 12, 'nick': 11, 'bellwether': 6}",49,"All we've gotta do is find out where they went, ",0.97301584,10,10,0.90625
668,971,dialog,HOPPS,Wait. Where'd they go? ,"{'hopps': 12, 'nick': 11, 'bellwether': 6}",49,Wait. Where'd they go? ,1.0,10,10,0.90625
669,972,dialog,NICK,"You know, if I wanted to avoid surveillance because I was doing something illegal-- which I never have-- I would use the maintenance tunnel 6B... which would put them out... ","{'hopps': 12, 'nick': 11, 'bellwether': 6}",49,"You know, if I wanted to avoid surveillance￼ because I was doing something illegal—which I never have—I'd use the maintenance￼ tunnel 6B, which would put them out… ",0.60691905,10,10,0.90625
670,974,dialog,NICK,...right there. ,"{'hopps': 12, 'nick': 11, 'bellwether': 6}",49,Right there.,0.8469486,10,10,0.90625
671,976,dialog,HOPPS,"Well, look at you, Junior Detective. You know, I think you'd actually make a pretty good cop. ","{'hopps': 12, 'nick': 11, 'bellwether': 6}",49,"Junior Detective. You know, I think you'd actually make a pretty good cop.",0.93103135,10,10,0.90625
672,977,dialog,NICK,How dare you. ,"{'hopps': 12, 'nick': 11, 'bellwether': 6}",49,"How dare you, ",0.88253665,10,10,0.90625
673,979,dialog,NICK,Acacia alley... Ficus underpass... South Canyon... ,"{'hopps': 12, 'nick': 11, 'bellwether': 6}",49,Rainforest District. Vine and Tujunga.,0.5387098,10,10,0.90625
674,980,dialog,HOPPS,They're heading out of town... Where does that road go? ,"{'hopps': 12, 'nick': 11, 'bellwether': 6}",49,Where does that road go? ,0.81580746,10,10,0.90625
675,983,dialog,WOLF GUARD,"Gary, quit it, you're gonna start a howl. ","{'hopps': 1, 'nick': 1}",50,"Quit it, Gary. You're gonna start a howl.",0.985271,11,11,1.0
676,984,dialog,GARY THE WOLF GUARD,I didn't start it. (more howling off-screen) Oooooooo! ,"{'hopps': 1, 'nick': 1}",50,I didn't start it. Ooooooooo! ,0.7475686,11,11,1.0
677,985,dialog,WOLF GUARD,Oooooooooo! ,"{'hopps': 1, 'nick': 1}",50,Ooooooooo! ,0.9821527,11,11,1.0
678,987,dialog,HOPPS,Come on! ,"{'hopps': 1, 'nick': 1}",50,Come on! ,1.0000001,11,11,1.0
679,989,dialog,NICK,You are a clever bunny. ,"{'hopps': 1, 'nick': 1}",50,"Clever bunny, ",0.78767216,11,11,1.0
680,992,dialog,HOPPS,It looks like this was a hospital. ,"{'hopps': 1, 'nick': 1}",51,"Looks like this was a hospital, ",0.9592168,11,11,0.5
681,994,dialog,NICK,"(turns to Hopps) You know, after you, you're the cop. ","{'hopps': 1, 'nick': 1}",51,"Officer Hopps, it's time.",0.7222233,13,11,0.5
682,996,dialog,NICK,Okay. All clear. ,"{'nick': 7, 'hopps': 7}",52,Okay.,0.6855148,28,11,0.8
683,998,dialog,HOPPS,All this equipment is brand new... ,"{'nick': 7, 'hopps': 7}",52,So my mom scraped together enough money to buy me a brand-new uniform.,0.3610938,9,11,0.8
684,999,dialog,NICK,Carrots...? ,"{'nick': 7, 'hopps': 7}",52,Carrots! ,0.8080809,19,11,0.8
685,1001,dialog,HOPPS,Claw marks... ,"{'nick': 7, 'hopps': 7}",52,Claw marks? ,0.9208785,11,11,0.8
686,1002,dialog,NICK,"Yeah. Huge, huge, claw marks. I mean, what kind of-- ","{'nick': 7, 'hopps': 7}",52,"Yeah, huge, huge claw marks. But what kind of anima—",0.809278,11,11,0.8
687,1004,dialog,HOPPS,Mr. Manchas. ,"{'nick': 7, 'hopps': 7}",52,"Mr. Manchas, ",0.9839538,11,11,0.8
688,1006,dialog,HOPPS,"It's him. We found our otter. (to the otter, gently) Mr. Otterton, my name is Officer Judy Hopps. Your wife sent me to find you. We're gonna get you out of here now. ","{'nick': 7, 'hopps': 7}",52,"Mr. Otterton, my name is Officer Judy Hopps. Your wife sent me to find you. We're gonna get you out of here now.",0.7861931,11,11,0.8
689,1008,dialog,NICK,Or not. Guess he's in no rush to get home to the Missus. ,"{'nick': 7, 'hopps': 7}",52,Guess he's in no rush to get home to the Mrs.,0.6564134,11,11,0.8
690,1010,dialog,HOPPS,"...11, 12, 13, 14. Not including Manchas it's 14... (lightbulb) Chief Bogo handed out 14 Missing Mammal files... They're all here. All the missing mammals are right here. ","{'nick': 7, 'hopps': 7}",52,Chief Bogo handed out fourteen missing mammal files… All the missing mammals are right here! ,0.74887615,11,11,0.8
691,1012,dialog,LIONHEART,"Enough! I don't want excuses, Doctor, I want answers. ","{'nick': 7, 'hopps': 7}",52,"I don't want excuses, Doctor, I want answers.",0.89573365,11,11,0.8
692,1014,dialog,BADGER DOCTOR,"Mayor Lionheart, please, we're doing everything we can. ","{'nick': 7, 'hopps': 7}",52,"Mayor Lionheart, please, ",0.8500565,11,11,0.8
693,1016,dialog,LIONHEART,"Really? Cuz I got a dozen and a half animals here who've gone off the rails crazy-- and you can't tell me why. Now, I'd call that awfully far from doing everything. ","{'nick': 7, 'hopps': 7}",52,"Because I got a dozen and a half animals here who've gone off-the-freaking-rails crazy, and you can't tell me why. I'd call that awfully far from doing everything.",0.90939134,11,11,0.8
694,1017,dialog,BADGER DOCTOR,"Sir, it may be time to consider their biology. ","{'nick': 7, 'hopps': 7}",52,"Sir, it may be time to consider their biology, ",0.9897429,11,11,0.8
695,1018,dialog,LIONHEART,What? What do you mean biology? ,"{'nick': 7, 'hopps': 7}",52,"Biology, Doctor? Spare me.",0.6951436,11,11,0.8
696,1019,dialog,BADGER DOCTOR,The only animals going savage are predators. We cannot keep it a secret. We need to come forward. ,"{'nick': 7, 'hopps': 7}",52,So predators are the only ones going savage? ,0.72234446,13,11,0.8
697,1020,dialog,LIONHEART,"Hmm... Great idea. Tell the public. And how do you think they're gonna feel about their mayor, who is a lion?! I'll be ruined! ","{'nick': 7, 'hopps': 7}",52,Let's not tell the mayor just yet—,0.6504115,28,11,0.8
698,1021,dialog,BADGER DOCTOR,"Well, what does Chief Bogo say? ","{'nick': 7, 'hopps': 7}",52,What does Chief Bogo think? ,0.8992426,11,11,0.8
699,1022,dialog,LIONHEART,Chief Bogo doesn't know. And we are going to keep it that way. ,"{'nick': 7, 'hopps': 7}",52,Chief Bogo doesn't know. And we are going to keep it that way.,1.0000001,11,11,0.8
700,1024,dialog,LIONHEART,Someone's here! ,"{'nick': 7, 'hopps': 7}",52,Someone's here! ,1.0,11,11,0.8
